the royal bank of scotland and,11
the number of people who are,11
one of the reasons for this,11
come to the attention of the,11
recognition of the fact that the,11
with the with the with the,11
she might not be able to,11
and went out of the room,11
be with you in a minute,11
she put a hand to her,11
to the ends of the earth,11
than anyone else in the world,11
i want nothing to do with,11
there was something about the way,11
used as the basis for a,11
let the cat out of the,11
on the other hand was a,11
at the nape of his neck,11
a hell of a long time,11
but from the point of view,11
there is also the problem of,11
and it is here that the,11
we can not be sure that,11
i know what i'm talking about,11
i thought it was a good,11
but on the other hand he,11
i du n no i just,11
on the face of it a,11
and it would be difficult to,11
it would be too much to,11
you'll be pleased to know that,11
his hands into the pockets of,11
hands into the pockets of his,11
now if you'll excuse me i,11
don't want anything to do with,11
seemed to be a lot of,11
we have come to expect from,11
make a great deal of difference,11
not least of which is the,11
from all over the country to,11
who asked not to be named,11
changes which have taken place in,11
which have taken place in the,11
for the vast majority of the,11
of which he was a member,11
have an adverse effect on the,11
seen as an integral part of,11
the health and safety executive and,11
at the end of the trial,11
it is important for you to,11
has an important part to play,11
for the second year in succession,11
for the first time in its,11
that i have been able to,11
of the state earnings related pension,11
that he did not know and,11
in the name of the father,11
he was in charge of the,11
that was a bit of a,11
going to be one of the,11
one two three one two three,11
the best way to do this,11
get up early in the morning,11
i don't want to go into,11
two hundred three hundred four hundred,11
where do you want to go,11
had no idea what he was,11
stood at the foot of the,11
from the sublime to the ridiculous,11
for the first time in two,11
it will be the first time,11
her hair back from her face,11
as they made their way to,11
put his head round the door,11
up with the rest of the,11
it had been one of the,11
i think i'm going to be,11
don't like the sound of that,11
concentrated in the hands of a,11
there is no restriction on the,11
you don't have to do this,11
how long is it since you,11
i think i'll go to bed,11
that is to say they are,11
in many other parts of the,11
they were in the middle of,11
we have a long way to,11
has come a long way since,11
from all parts of the world,11
on the rights of the child,11
less than a quarter of the,11
they may or may not be,11
at other times of the year,11
we saw in the last chapter,11
in the eyes of the law,11
it's not as simple as that,11
to be able to see the,11
and there are one or two,11
there doesn't seem to be much,11
have to have a word with,11
go and have a look in,11
i didn't want to tell you,11
it's a it's a it's a,11
have a look and see what,11
the chairman of the revolutionary command,11
chairman of the revolutionary command council,11
may include any number of regiments,11
include any number of regiments of,11
as described in the warhammer rulebook,11
out of the exchange rate mechanism,11
on the western side of the,11
at a particular point in time,11
the fact that the majority of,11
the answer is that it is,11
for the second half of the,11
from the office of population censuses,11
that it is almost impossible to,11
go on for a long time,11
an hour and a half later,11
to draw up a list of,11
for the benefit of the community,11
and the ways in which they,11
that there is a place for,11
technical and vocational education initiative tvei,11
the size and complexity of the,11
more than compensated for by the,11
as normal a life as possible,11
the latest in a long line,11
so what do you think of,11
what is going to happen to,11
as far as i'm concerned it,11
put her head round the door,11
there was nothing to do but,11
never seen anything like it before,11
during the first world war and,11
there will be an increase in,11
what we are trying to achieve,11
you've got to you've got to,11
the national endowment for the arts,11
what they were going to do,11
what do you think about the,11
three or four times a year,11
it is not for us to,11
the foreign secretary mr douglas hurd,11
to be little more than a,11
on the other hand if there,11
it would have been difficult for,11
there is still much to be,11
she was a member of the,11
and i think that it is,11
is final and no correspondence will,11
would be a mistake to assume,11
be a mistake to assume that,11
depends on a number of factors,11
sat at the head of the,11
if you do not wish to,11
in the blink of an eye,11
bearing in mind the fact that,11
is the other side of the,11
of the matter is that the,11
on either side of the road,11
the benefit of the doubt and,11
think they can get away with,11
have made it clear that they,11
this is the best way to,11
have a look at some of,11
in the hands of the police,11
so that at the end of,11
had been having an affair with,11
to make a statement to the,11
have to do a lot of,11
and we used to have to,11
of the amalgamated engineering and electrical,11
may or may not be a,11
is based on the idea that,11
in other words it is the,11
and all that he could see,11
whin whin whin hi ho hi,11
whin whin hi ho hi ho,11
and shoulders knees and toes knees,11
the rain came down and the,11
where did you get that from,11
i don't know whether you can,11
what was i going to say,11
i don't know what i'm going,11
er what do you call it,11
go and make a cup of,11
gon na be able to get,11
i don't want to do that,11
what do you think i should,11
now what are you going to,11
i think it's i think it's,11
what do you think it is,11
if you want to do it,11
been trying to get hold of,11
we'll have a look at it,11
i mean i du n no,11
i shall look forward to it,11
sixteen eighteen twenty twenty two twenty,11
i don't know i mean i,11
on to the roof of the,11
what do we have to do,11
by the time i get to,11
five seventy seventy five eighty eighty,11
or gcse pass in mathematics at,11
gcse pass in mathematics at grade,11
pass in mathematics at grade c,11
grade c or above is required,11
completion of the year of placement,11
the diploma in industrial studies upon,11
diploma in industrial studies upon graduation,11
as a major joint or minor,11
institution for the deaf and dumb,11
of the eleventh and twelfth centuries,11
the british deaf and dumb association,11
despite the fact that he had,11
it is a sad fact that,11
i am sorry to say that,11
of the success or failure of,11
that they do not have to,11
would be the first to admit,11
at the mouth of the river,11
time to come to terms with,11
ahead of the rest of the,11
opened his mouth to speak but,11
do what you have to do,11
it is a fact of life,11
is well on the way to,11
right on the edge of the,11
that we should be able to,11
in the centre of the floor,11
was one of the most popular,11
who is in charge of the,11
on the edge of her bed,11
dealt with in a later chapter,11
and other parts of the country,11
and it was not until the,11
in the course of the evening,11
i've got something to tell you,11
usually takes the form of a,11
there is a conflict between the,11
home at the end of the,11
anything i can do to help,11
how long have you been in,11
what would it be like to,11
and put it in his pocket,11
the decline in the number of,11
over the past few years and,11
have a vested interest in the,11
it is worth remembering that the,11
be now read a second time,11
rank as one of the most,11
i'd like to be able to,11
distinction between numerical and qualitative identity,11
not be defined in terms of,11
the area of the event horizon,11
there used to be a a,11
not so much because of the,11
i don't know what will happen,11
in the event of your death,11
want to have anything to do,11
r v secretary of state for,11
not to lose sight of the,11
one of the first things he,11
of all the members of the,11
at each other for a moment,11
the late seventies and early eighties,11
members in all parts of the,11
in no time at all the,11
an attempt will be made to,11
well on the way to recovery,11
it's nice to be able to,11
royal national institute for the blind,11
wake up in the morning and,11
which can then be used to,11
the new international division of labour,11
the suburban book of the dead,11
and ten one twenty one thirty,11
hundred and twenty four fifty four,11
four hundred four twenty four fifty,11
four twenty four fifty four eighty,11
at four hundred and fifty pounds,11
pounds any more at one hundred,11
for a hundred pounds at one,11
a hundred pounds at one hundred,11
for three hundred pounds at three,11
containing one or more of these,11
this option allows the user to,11
created in the directory specified in,11
the user associated with the dc,11
parameter providing a report of the,11
providing a report of the errors,11
this field is left blank the,11
transfer schedule keyword in the rdbi,11
schedule keyword in the rdbi configuration,11
configuration file and ensure that the,11
is displayed this means that the,11
this option but you must be,11
lifespan will automatically display the last,11
in the current list as the,11
must already exist and must not,11
must already exist and must have,11
already exist and must have been,11
using one of the characters r,11
if the entry is blank the,11
the entry is blank the mail,11
entry is blank the mail message,11
is blank the mail message has,11
blank the mail message has not,11
the mail message has not been,11
mail message has not been inspected,11
name is not known to lifespan,11
technical support department for further advice,11
one forty one fifty one sixty,11
four three four three four to,11
liverpool north wales and irish region,11
general synod of the church of,11
there are so many of them,11
the root cause of the problem,11
appeal from the court of appeal,11
it was the result of a,11
you have to do is complete,11
if you have a look at,11
the last thing i wanted to,11
a member of the computer group,11
the legitimacy of corporate managerial power,11
at all hotels honeymoon and silver,11
all hotels honeymoon and silver anniversary,11
silver anniversary couples staying at the,11
range of wines whiskies and beers,11
the second person of the trinity,11
their understanding of the world of,11
in the interests of the shareholders,11
like you to do is to,11
it remains to be seen if,11
than a quarter of a million,11
at the top of the agenda,11
by the leader of the opposition,11
the meaning of a word is,11
abusive or insulting words or behaviour,11
of the people of this country,11
lord donaldson master of the rolls,11
for details see the poster in,11
details see the poster in the,11
see the poster in the church,11
the poster in the church porch,11
by anna tomforde in east berlin,11
for the second time in a,11
the advisory conciliation and arbitration service,11
the minister for the civil service,11
off the bottom of the table,11
his first game of the season,11
had two sons and two daughters,11
for russian and east european studies,11
am indeed sir a surgeon to,11
their shoes to get myself into,11
shoes to get myself into more,11
you sir what trade are you,11
one and a half million pounds,11
interradial areas are also covered with,11
the oral shield is rounded triangular,11
the tips of the radial shields,11
tips of the radial shields are,11
not separating it from the first,11
separating it from the first lateral,11
it from the first lateral arm,11
with an obtuse proximal angle and,11
ventral interradial areas are covered by,11
the financial secretary to the treasury,11
that the secretary of state will,11
the secretary of state and his,11
my right hon friend will be,11
down at one dollar fifty and,11
hundred shares index closed down seven,11
shares index closed down ten point,11
hundred shares index closed down fifteen,11
hundred shares index closed up thirty,11
nigel jones mp lib dem cheltenham,11
hundred shares index closed up five,11
shares index closed down one point,11
hundred shares index closed down three,11
and down at two marks thirty,11
a man has appeared in court,11
back ref anne still to come,11
ref anne still to come on,11
one dollar forty nine and down,11
dollar forty nine and down at,11
forty nine and down at two,11
nine and down at two marks,11
two and down at two marks,11
one and up at two marks,11
and up at two marks eighty,11
by david greenwood daily post staff,11
by malcolm handley regional affairs correspondent,11
you plead guilty or not guilty,11
the speech prepared by my noble,11
speech prepared by my noble and,11
prepared by my noble and learned,11
the applicants in the main proceedings,11
of lord donaldson of lymington mr,11
going to the party and i'm,11
goal or for a path a,11
i hope that my right hon,11
the right hon member for yeovil,11
my hon friend to the answer,11
remarks of the hon member for,11
hon friend the member for islington,11
state foreign and commonwealth office mr,11
hope that the hon member for,11
right hon and learned friend and,11
right hon friend accept that the,11
the chancellor of the exchequer what,11
the minister for local government and,11
member for harrow west mr hughes,11
my hon friend is entirely right,11
by the hon and learned member,11
which my hon friend the member,11
the hon member for kingston upon,11
hon member for kingston upon hull,11
right hon friend agree that it,11
friend the leader of the opposition,11
member for oldham west mr meacher,11
point of order mr deputy speaker,11
the hon member for islington south,11
hon member for islington south and,11
learned friend the member for leicester,11
friend the member for leicester west,11
hon and learned member for leicester,11
and learned member for leicester west,11
purpose of the research is to,11
the organization of american states oas,11
vested in the president who is,11
committee of the red cross icrc,11
the prime minister and cabinet are,11
the dougie down under competition thanks,11
dougie down under competition thanks to,11
down under competition thanks to quantas,11
under competition thanks to quantas australia's,11
competition thanks to quantas australia's national,11
the resolution to the meeting those,11
resolution to the meeting those in,11
the hon gentleman will be aware,11
i assure my hon friend that,11
the republics of the former soviet,11
the right hon gentleman aware that,11
i agree with the hon member,11
i am sure that the minister,11
twenty six twenty eight thirty pounds,11
ten again to start it then,11
they had one son and one,11
had one son and one daughter,11
and repeat with the same elbow,11
raise the elbows head and shoulders,11
head and shoulders off the floor,11
repeat on the other side then,11
on the other side then repeat,11
the other side then repeat again,11
other side then repeat again on,11
side then repeat again on both,11
then repeat again on both sides,11
down and relax for a few,11
and over as far as possible,11
elbows head and shoulders bringing your,11
a certain motor vehicle namely a,11
northern echo reporters work throughout south,11
echo reporters work throughout south west,11
reporters work throughout south west durham,11
work throughout south west durham and,11
throughout south west durham and darlington,11
south west durham and darlington to,11
west durham and darlington to bring,11
durham and darlington to bring you,11
and darlington to bring you the,11
darlington to bring you the region's,11
glory to god glory to god,11
home you bum go home you,10
you bum go home you bum,10
bum go home you bum go,10
mums group is aimed at mums,10
the general council of the tuc,10
in the event of a hung,10
the event of a hung parliament,10
much the same way as it,10
the national executive committee of the,10
do you want to come and,10
will not be subject to any,10
have come at a worse time,10
that this was going to be,10
of the national health service and,10
it is clear that in the,10
there was no doubt that he,10
with a cup of tea and,10
there is no mention of the,10
that he or she does not,10
i got to my feet and,10
it was simply a matter of,10
i don't see why i shouldn't,10
other end of the scale there,10
as much or as little as,10
borne out by the fact that,10
there is so much to see,10
it would not be in the,10
at the end of world war,10
the united kingdom atomic energy authority,10
use of a wide range of,10
will have to wait until the,10
but it soon became clear that,10
it goes without saying that the,10
there is nothing to suggest that,10
have never had it so good,10
the other side of the hedge,10
took her in his arms and,10
put his finger to his lips,10
he didn't know what he was,10
the first time in his career,10
sit on the edge of the,10
to the table and sat down,10
other side of the road and,10
i think i must have been,10
at the end of the village,10
room at the end of the,10
and with the help of a,10
it should be emphasised that the,10
at the bottom of the sea,10
it did not occur to him,10
down to earth with a bump,10
as we have seen this is,10
know all there is to know,10
about the same time as the,10
out of all proportion to its,10
there may be a need to,10
time in the history of the,10
in the wider context of the,10
in the beginning was the word,10
for the rest of the decade,10
the museum of modern art in,10
it is a fair bet that,10
the end of the year we,10
to take the place of the,10
of the people all of the,10
the people all of the time,10
could be said to have been,10
over the hills and far away,10
it was some time before the,10
for more than a few minutes,10
no reason why you should not,10
it is possible to identify a,10
the most likely explanation is that,10
for the first time she was,10
had no idea what was going,10
the table in front of him,10
the younger members of the family,10
it is in the field of,10
the one hand there is the,10
and there is no need for,10
it is not so much that,10
the context in which it is,10
the back of her neck and,10
does not take much imagination to,10
never heard of such a thing,10
to be seen to be doing,10
there is always the problem of,10
in such a way that we,10
it was not the sort of,10
something to do with the way,10
at the corners of her mouth,10
there was nothing to be done,10
the names of some of the,10
at him as if he were,10
would be the end of the,10
during the latter part of the,10
in other words there is a,10
and there is some evidence that,10
made it clear that it was,10
as to what was going on,10
get the best out of the,10
the past few years we have,10
the development board for rural wales,10
the central council of physical recreation,10
there is always the danger that,10
at the start of the new,10
to opt out of local authority,10
on the opening day of the,10
the public has a right to,10
you are going to have a,10
as well as the rest of,10
it is not as simple as,10
it is hard to imagine a,10
was put in charge of the,10
of the royal institute of british,10
it was easy to see why,10
you will have the chance to,10
free at the point of delivery,10
in the north of the county,10
there has been a tendency for,10
as well as many of the,10
there was no way they could,10
what on earth are you talking,10
on earth are you talking about,10
it is not easy to find,10
there is reason to believe that,10
of the old and the new,10
to change the nature of the,10
alone in the middle of the,10
majority voting in the council of,10
voting in the council of ministers,10
it is difficult to imagine that,10
as may be necessary for the,10
all you want to do is,10
the rest of this chapter will,10
the person to whom it is,10
left to the discretion of the,10
have you heard the one about,10
a great deal of time to,10
after the first world war the,10
in the best interest of the,10
and i think it is a,10
the american association for the advancement,10
get out of bed in the,10
to decide what to do with,10
there was no way we could,10
at the end of a busy,10
the work of the holy spirit,10
the end of the last war,10
i think that's a good idea,10
the same could not be said,10
was going to have to be,10
and got out of the car,10
i've got to go to the,10
going to have a look at,10
round the corner of the house,10
round to the other side of,10
that the people of northern ireland,10
that there was no evidence to,10
but there can be little doubt,10
had been in and out of,10
a quarter of a million people,10
had no choice in the matter,10
to be the end of the,10
with more than a hint of,10
it was the first time he'd,10
the first time she had ever,10
what were you going to say,10
it did not occur to her,10
you don't want to go to,10
in the middle of the bed,10
it was time to go home,10
was nothing to do with her,10
in the middle of the pavement,10
i did not want to be,10
the first time he had been,10
could not bear the thought of,10
everything was going to be all,10
what was the matter with her,10
it was in this way that,10
that it was the first time,10
out of the front door and,10
but by the middle of the,10
tell us a great deal about,10
is in the centre of the,10
to the second half of the,10
is to be found in a,10
it is perhaps surprising that the,10
it should be made clear that,10
it is now widely accepted that,10
it takes the form of a,10
put his arm round her shoulders,10
but there was no need to,10
it was too late to do,10
to be told what to do,10
a bit of a shock to,10
let him get away with it,10
what on earth was going on,10
there was no need for a,10
he turned his attention to the,10
you don't have to do anything,10
it is not enough to say,10
that is not the end of,10
of the labour party and the,10
trade unions and the labour party,10
it must be shown that the,10
at the bottom of the steps,10
i don't know where to start,10
to take my word for it,10
the decline and fall of the,10
in the news of the world,10
it's a long time since i,10
taken a turn for the worse,10
it must also be said that,10
in the middle years of the,10
that there are different kinds of,10
the editor reserves the right to,10
i don't know what they are,10
if there is a change in,10
one of the aims of this,10
from the point of view that,10
to spend more time with his,10
had absolutely nothing to do with,10
it's got something to do with,10
it is a sad reflection on,10
do not take into account the,10
the same way as it is,10
it is not clear from the,10
who did he think he was,10
spend the rest of his life,10
only one way to find out,10
was no reason for him to,10
than anything else in the world,10
at the back of his throat,10
i thought i told you to,10
in a fraction of the time,10
from the corner of his eye,10
he was wearing a pair of,10
it was late in the afternoon,10
stand in the middle of the,10
where you will be able to,10
to be at the end of,10
on the back seat of the,10
how do you know all this,10
the table in front of her,10
had no idea what to do,10
of which it is a part,10
the view that there is a,10
think it's a good idea to,10
put her head on one side,10
if he was going to be,10
but i can assure you that,10
i can do what i like,10
perhaps it was just as well,10
by the government of the day,10
at the annual general meeting of,10
born with a silver spoon in,10
the latter half of the twentieth,10
latter half of the twentieth century,10
in the national health service and,10
the church of england and the,10
in the middle decades of the,10
to improve the quality of their,10
to make an impact on the,10
it is safe to say that,10
a small proportion of the population,10
of this can be found in,10
it more and more difficult to,10
in the last decade or so,10
to be borne in mind that,10
so far we have been concerned,10
to be taken into account and,10
is the most effective way of,10
it is up to us to,10
it was taken for granted that,10
for the purposes of this book,10
as can be seen in the,10
in the same way as in,10
get on with the business of,10
over the heads of the crowd,10
was not simply a matter of,10
and there was a bit of,10
seemed to me to be a,10
you have to go to the,10
i would like to have been,10
was to become one of the,10
or whatever you like to call,10
don't know if i want to,10
this was partly due to the,10
this was despite the fact that,10
the be all and end all,10
a statement rather than a question,10
there was no sign of either,10
it is easy to assume that,10
heard the sound of a car,10
i have it on good authority,10
it took me a while to,10
was one of the very few,10
i would like to hear from,10
the war to end all wars,10
in the fifteenth and sixteenth centuries,10
by the fact that she was,10
but it is important to remember,10
and there was no point in,10
at the very centre of the,10
you have to bear in mind,10
you give me an example of,10
and there was no need to,10
i thought she was going to,10
what was she going to do,10
if it was the last thing,10
as if he were about to,10
am i going to do with,10
membership of the european monetary system,10
this is likely to be a,10
the best thing to do with,10
them in the middle of the,10
out of all proportion to their,10
