he took a step towards her,19
as a matter of fact it,19
i was going to tell you,19
i would like to thank the,19
that there was a need for,19
it was almost as if he,19
i don't have to tell you,19
which turned out to be a,19
was one of the reasons why,19
was the order of the day,19
at the back of her head,19
get to the bottom of it,19
the end of the second year,19
time of the day or night,19
a common foreign and security policy,19
but it was not to be,19
is much more likely to be,19
it was just one of those,19
to be on the receiving end,19
get up in the morning and,19
it can also be used to,19
there is still a long way,19
is still a long way to,19
nine ten eleven twelve thirteen fourteen,19
and have a look at the,19
indicated on the card itself see,19
on the card itself see warhammer,19
the card itself see warhammer battle,19
card itself see warhammer battle magic,19
the object management group's common object,19
object management group's common object request,19
management group's common object request broker,19
best thing that could have happened,19
of the joint chiefs of staff,19
is one of the most difficult,19
in the northern part of the,19
department of trade and industry to,19
the last quarter of the nineteenth,19
last quarter of the nineteenth century,19
got nothing to do with it,19
an attempt has been made to,19
there has been a great deal,19
has been a great deal of,19
i wanted to talk to you,19
is a good example of the,19
the abolition of the death penalty,19
power in the hands of the,19
tip toe tip toe tip toe,19
if you're happy and you know,19
you're happy and you know it,19
i don't think i want to,19
up and down up and down,19
the end of the day it's,19
the committee of vicechancellors and principals,19
no such thing as a free,19
five hundred and fifty six hundred,19
one ninety two hundred two twenty,19
fifty six hundred and fifty seven,19
four fifty four eighty five hundred,19
error message will be displayed at,19
message will be displayed at the,19
status_return returns true if no errors,19
lifespan_user is an input parameter specifying,19
also specifies the device directory where,19
that the details are correct and,19
an explanation of the error codes,19
explanation of the error codes can,19
of the error codes can be,19
the error codes can be found,19
the next page press the tab,19
next page press the tab key,19
lifespan and therefore can not be,19
by nicholas timmins health services correspondent,19
can not be named for legal,19
not be named for legal reasons,19
truly sir to wear out their,19
and down at two marks fifty,19
hundred shares index closed up twenty,19
but first with the sport here's,19
first with the sport here's tim,19
is up at one dollar ninety,19
by richard williams daily post staff,19
referred to in the judgment of,19
parliamentary undersecretary of state for the,19
to my hon friend for his,19
what recent representations he has received,19
i have been asked to reply,19
right hon and learned friend agree,19
right hon member for birmingham sparkbrook,19
hon member for birmingham sparkbrook mr,19
my right hon friend for that,19
then jog properly for as long,19
jog properly for as long as,19
and record the number of steps,19
right in the centre of the,18
it is hard to think of,18
it will be some time before,18
the first two years of the,18
by then it was too late,18
house of commons select committee on,18
on the back of his neck,18
it would have been difficult to,18
after the second world war and,18
he was on the point of,18
the second half of the twentieth,18
second half of the twentieth century,18
after the end of the war,18
but there can be no doubt,18
as we have seen it is,18
it seemed to me that the,18
for the first time in three,18
for the first time in this,18
the royal institute of british architects,18
good the bad and the ugly,18
it would be more accurate to,18
what it is to be a,18
has to be said that the,18
to the front of the house,18
that was one of the things,18
i think there's a lot of,18
back the way they had come,18
what was going to happen to,18
to play an important part in,18
what you are going to do,18
it has to be remembered that,18
what do you think i am,18
i had nothing to do with,18
i have to tell you that,18
what it feels like to be,18
the end of the thirteenth century,18
has come to be known as,18
how are you getting on with,18
what you see is what you,18
if you do not want to,18
as a matter of fact he,18
for the first time in many,18
speaker of the house of commons,18
at the best of times and,18
it was the end of the,18
has to be taken into account,18
over a quarter of a century,18
him for the rest of his,18
is probably true to say that,18
is in the form of a,18
think it would be better if,18
played an important role in the,18
i was on my way to,18
given a new lease of life,18
a vital role to play in,18
designed to meet the needs of,18
there was no one in the,18
the organisation for economic cooperation and,18
on the eastern side of the,18
reform of the common agricultural policy,18
at time of going to press,18
i have never been able to,18
that got to do with it,18
draw attention to the fact that,18
where do we go from here,18
once upon a time there was,18
in the centre of the table,18
an hour and a half to,18
for as long as she could,18
come and have a look at,18
the turn of the century and,18
from this point of view the,18
have to put up with it,18
towards the end of the century,18
she didn't know what to do,18
see the wood for the trees,18
and it is difficult to see,18
that he had no intention of,18
that there is a need to,18
there was nothing wrong with the,18
the hairs on the back of,18
in the same way as they,18
i would very much like to,18
as is so often the case,18
for as long as you can,18
in the palm of his hand,18
it is of course true that,18
to come to terms with it,18
there doesn't seem to be any,18
one of the most important factors,18
there was nothing we could do,18
end of the nineteenth century the,18
so what are you going to,18
at the museum of modern art,18
as a result of the government's,18
there is no reason why they,18
to build up a picture of,18
is by no means the only,18
has to be one of the,18
on the south bank of the,18
to be seen to be believed,18
they would not be able to,18
of the main reasons for the,18
to the director of public prosecutions,18
when i was a little girl,18
and there is no reason to,18
by the time you read this,18
it was as a result of,18
the middle of the last century,18
different parts of the country and,18
and i don't want to be,18
if you want to know what,18
it is only too easy to,18
the best interests of the child,18
to make the most of your,18
will be able to advise you,18
if you want to find out,18
in the rest of this chapter,18
it is important to be aware,18
eastern europe and the soviet union,18
by the monopolies and mergers commission,18
the other end of the room,18
it took me a long time,18
from time to time in the,18
on the outskirts of the village,18
it is difficult to avoid the,18
of the european court of justice,18
there is some evidence that the,18
not be in a position to,18
it is a bit of a,18
we have to do is to,18
that there was no need for,18
that there is no need to,18
remains to be seen whether the,18
what are you doing here she,18
has nothing to do with it,18
on the site of the old,18
will be discussed in the next,18
the first time in their lives,18
it was not going to be,18
wrap the ribbon around the edge,18
the ribbon around the edge of,18
i call upon councillor to move,18
ordinarily resident in the united kingdom,18
in any part of the world,18
all the circumstances of the case,18
by the court of appeal in,18
there are one or two things,18
to get him out of the,18
as we have seen in the,18
at the same time as he,18
what we're trying to do is,18
at the time of the contract,18
would like to hear from anyone,18
a solution to the problem of,18
as a proportion of the total,18
the end of the fifteenth century,18
in the nineteenth and early twentieth,18
the secretary of state and the,18
an abuse of the process of,18
i don't like the look of,18
to find out what it was,18
hope you will be able to,18
were to be found in the,18
that it would be better to,18
the best interests of the children,18
on the other hand they are,18
to play an important role in,18
that it is one of the,18
it can not be denied that,18
i said to him i said,18
it might be an idea to,18
part of the problem is that,18
to see if there were any,18
part of the reason for this,18
the other side of the table,18
down in the middle of the,18
to err on the side of,18
a true and fair view of,18
that seems to me to be,18
university of wales institute of science,18
does not necessarily mean that the,18
we want to be able to,18
am i right in saying that,18
of the leader of the opposition,18
to make sure that they are,18
miss j r gibling secretary mrs,18
will be dealt with in the,18
i'll be with you in a,18
was nothing she could do about,18
there were tears in her eyes,18
what on earth do you mean,18
the other side of the wall,18
in the back of her mind,18
the only person in the world,18
hesitate to contact me if you,18
are we going to do with,18
right at the end of the,18
the end of one of the,18
i don't know what that is,18
there was the sound of a,18
looking from one to the other,18
the best way to deal with,18
what the hell was going on,18
it was clear that he was,18
appeal to the court of appeal,18
at the lower of cost and,18
any time of the day or,18
to look more closely at the,18
have a look at it and,18
considered to be one of the,18
the fact that it was a,18
that has nothing to do with,18
to make the best of it,18
just for the sake of it,18
i didn't know what to say,18
at a fraction of the cost,18
off in the direction of the,18
at some time in the past,18
the open software foundation's distributed computing,18
open software foundation's distributed computing environment,18
group's common object request broker architecture,18
would you like to go to,18
in front of the fire and,18
please could you give me some,18
i'm gon na have to go,18
hang on hang on hang on,18
i du n no what to,18
na na na na na na,18
want to go to bed with,18
the concept of the created god,18
from the far end of the,18
when i got back to the,18
mechanism of the european monetary system,18
can i do for you today,18
creating and controlling modules and packages,18
and controlling modules and packages with,18
controlling modules and packages with lifespan,18
input parameter specifying the lifespan username,18
parameter specifying the lifespan username and,18
will be displayed at the top,18
be displayed at the top of,18
displayed at the top of the,18
because a fatal error has occurred,18
a fatal error has occurred in,18
fatal error has occurred in a,18
error has occurred in a previous,18
has occurred in a previous area,18
occurred in a previous area of,18
in a previous area of lifespan,18
a previous area of lifespan rdbi,18
finally confirm that the details are,18
confirm that the details are correct,18
column if any invalid information has,18
if any invalid information has been,18
any invalid information has been entered,18
you should press the return key,18
seventy five eighty eighty five ninety,18
was the first of its kind,18
nottingham three four three four three,18
to see caesar and to rejoice,18
see caesar and to rejoice in,18
caesar and to rejoice in his,18
and to rejoice in his triumph,18
united nations high commissioner for refugees,18
honeymoon and silver anniversary couples staying,18
and silver anniversary couples staying at,18
of a breach of the peace,18
by frank kane chief city reporter,18
and leader of the house of,18
legs swinging from side to side,18
but as you would say a,18
truly sir all that i live,18
as you would say a cobbler,18
goes and he goes what and,18
colleges and institutes of higher education,18
secretary of state sir patrick mayhew,18
by geoff barnes daily post staff,18
by david banks daily post staff,18
are not a brain in a,18
right hon friend the chancellor of,18
hon friend the chancellor of the,18
to the answer that i gave,18
state for education and science mr,18
hon and learned friend agree that,18
will my hon friend confirm that,18
northern ireland if he will make,18
ireland if he will make a,18
member for manchester gorton mr kaufman,18
member for islington south and finsbury,18
his hon friend the member for,18
is right to draw attention to,18
i know that my hon friend,18
by david scott local government editor,18
the outbreak of the second world,17
outbreak of the second world war,17
towards the end of the month,17
but on the other hand i,17
at the upper end of the,17
the house of commons and the,17
to make the most of their,17
to be the subject of a,17
before the end of the century,17
there was a time when the,17
if you have a lot of,17
of the second world war and,17
at the department of the environment,17
at the time of the murder,17
of the house of lords and,17
he took her in his arms,17
first time in his life he,17
the first time since he had,17
spent a lot of time in,17
on to the top of the,17
it was love at first sight,17
this is one of the few,17
all the way down to the,17
is important to be able to,17
it would be quite wrong to,17
it is difficult to assess the,17
for the majority of the population,17
who for one reason or another,17
had to be seen to be,17
i want you to know that,17
was to be one of the,17
should not be confused with the,17
what turned out to be a,17
make a significant contribution to the,17
the constitution of the united kingdom,17
the rest of the world is,17
than the sum of its parts,17
you could be forgiven for thinking,17
it is more than likely that,17
can only be a matter of,17
will be interesting to see whether,17
to make a contribution to the,17
no reason why they should not,17
the prevention of cruelty to children,17
get the most out of your,17
how long have you been here,17
do you want me to come,17
and it is not surprising that,17
on the other hand it can,17
would be nice to think that,17
there is no reason to think,17
i find it very difficult to,17
a hell of a lot more,17
the introduction of the national curriculum,17
be in the form of a,17
it may be argued that the,17
attention to the fact that the,17
that was one of the reasons,17
in the last two or three,17
be the order of the day,17
at the end of the hall,17
just have to put up with,17
a bit of getting used to,17
members of the house of lords,17
has been the subject of a,17
late eighteenth and early nineteenth centuries,17
is based on the assumption that,17
for a couple of days and,17
and spent the rest of the,17
that he did not want to,17
her head to look at him,17
it would be nice to see,17
there's a lot to be said,17
first thing to do is to,17
and you will be able to,17
there is nothing i can do,17
what would you do if you,17
put his hand in his pocket,17
was one of the things that,17
on the second floor of the,17
it is easy to forget that,17
of the community as a whole,17
in the eleventh and twelfth centuries,17
it was the beginning of the,17
of the most important aspects of,17
in the right frame of mind,17
if you are going to be,17
i think it is fair to,17
think it is fair to say,17
it was not so much the,17
no more and no less than,17
it in such a way that,17
have nothing to do with it,17
i don't know who it was,17
there is no doubt about the,17
to become a member of the,17
in the middle of the nineteenth,17
in the twelfth and thirteenth centuries,17
at the very top of the,17
is no reason why they should,17
in the middle of the field,17
is by no means certain that,17
to such an extent that the,17
there's nothing i can do about,17
there were quite a lot of,17
between now and the end of,17
this that and the other and,17
it is easy to understand why,17
you see is what you get,17
in britain and the united states,17
every effort will be made to,17
university of manchester institute of science,17
from all parts of the country,17
he had never been able to,17
found it hard to believe that,17
one of the aims of the,17
the top end of the market,17
a b c d e f,17
lot of work to be done,17
at the southern end of the,17
to deal with the problems of,17
as far as the eye can,17
find out as much as possible,17
during the early part of the,17
is difficult to see how the,17
the end of the twentieth century,17
a quarter of a mile away,17
it is not hard to see,17
be very grateful if you could,17
one of the first to be,17
to take an interest in the,17
make the best use of the,17
action on the part of the,17
there is no reason to doubt,17
to the end of the century,17
in such a manner as to,17
it must be said that the,17
in the extent to which they,17
she looked up at him and,17
what do you say to that,17
at a time when it was,17
a long way to go and,17
two for the price of one,17
the difference between right and wrong,17
the end of the day he,17
it was out of the question,17
had little to do with the,17
more than a quarter of the,17
the edge of the cake drum,17
action for breach of statutory duty,17
the best interests of the company,17
in recent years there have been,17
that in the course of the,17
just for the hell of it,17
it can not be assumed that,17
in the early stages of a,17
there does not appear to be,17
it is not clear whether this,17
on the part of the defendant,17
they may not be able to,17
it would be as well to,17
it is a matter for the,17
you need to be aware of,17
don't know how to do it,17
had anything to do with it,17
at the end of each day,17
it was the right thing to,17
on the same day as the,17
on the part of the teacher,17
at the end of the process,17
it might be argued that the,17
the first half of this century,17
the end of the day is,17
you want to get rid of,17
i can't remember what it was,17
to the secretary of state and,17
the society for the protection of,17
room at the top of the,17
to play a full part in,17
of state for the environment and,17
towards the end of the war,17
what are we gon na do,17
to give you an idea of,17
it can not be said that,17
that in the event of a,17
we need to do is to,17
it had been a long time,17
was at the back of the,17
people from all walks of life,17
by the end of the period,17
is not to say that they,17
and it is not possible to,17
it is no longer possible to,17
at the beginning of the chapter,17
are you sure you want to,17
is the name given to the,17
it would be difficult to find,17
within a short space of time,17
to be a part of it,17
had nothing to do with his,17
head in the direction of the,17
the thin end of the wedge,17
but at the same time she,17
was also a member of the,17
i thought we were going to,17
on the last day of the,17
is at the centre of a,17
there was no question of the,17
i think that there is a,17
want to have a look at,17
what we do know is that,17
on the floor in front of,17
quite apart from the fact that,17
the decision of the court of,17
in the second part of the,17
yeah i know what you mean,17
it is not a good idea,17
there's a long way to go,17
i don't know what's going on,17
will be able to tell you,17
she was in love with him,17
made the sign of the cross,17
it was on the tip of,17
for the rest of our lives,17
don't know the first thing about,17
is a step in the right,17
on the end of the bed,17
the latter part of the nineteenth,17
latter part of the nineteenth century,17
just in time to see the,17
the best way to do it,17
better to be safe than sorry,17
it will be a long time,17
there is no doubt that they,17
is the order of the day,17
to be a bit of a,17
do you know what it is,17
the first edition of this book,17
i don't know what i'd do,17
divisional court of the queen's bench,17
court of the queen's bench division,17
i am well aware of the,17
the more likely you are to,17
erm what do you call it,17
i am pleased to say that,17
be on the receiving end of,17
was sitting on the edge of,17
the best thing that could have,17
but on the other hand the,17
there is every reason to believe,17
it is just a matter of,17
what am i gon na do,17
are a lot of people who,17
there was nothing they could do,17
name and address on a postcard,17
be that as it may the,17
the amalgamated engineering and electrical union,17
toe tip toe tip toe tip,17
this is not the same as,17
but it would be wrong to,17
some or all of the following,17
i want to do is to,17
exchange rate mechanism of the european,17
rate mechanism of the european monetary,17
be one of the most important,17
two hundred two twenty two forty,17
eighty three hundred three twenty three,17
ninety two hundred two twenty two,17
twenty four fifty four eighty five,17
eighty one ninety two hundred two,17
specifying the lifespan username and password,17
the lifespan username and password to,17
lifespan username and password to be,17
username and password to be used,17
and password to be used to,17
password to be used to access,17
to be used to access lifespan,17
the device directory where any errors,17
device directory where any errors will,17
directory where any errors will be,17
where any errors will be reported,17
a report of the errors encountered,17
report of the errors encountered during,17
of the errors encountered during the,17
the errors encountered during the attempt,17
correct the error reported and then,17
the error reported and then rerun,17
error reported and then rerun lifespan,17
reported and then rerun lifespan rdbi,17
and an error message will be,17
to proceed to the next page,17
proceed to the next page press,17
to the next page press the,17
is acceptable lifespan will automatically display,17
known to lifespan and therefore can,17
to lifespan and therefore can not,17
technology technical support department for more,17
technical support department for more information,17
support department for more information on,17
department for more information on rdbi,17
sixty two eighty three hundred three,17
such thing as a free lunch,17
the united nations high commissioner for,17
is a corporate member of wacc,17
the five permanent members of the,17
to the starting position and repeat,17
sir all that i live by,17
and he goes and he goes,17
we pray for those who are,17
and commonwealth affairs if he will,17
hundred shares index closed down twenty,17
by david jones daily post staff,17
of state for the armed forces,17
you are not a brain in,17
taking the side of the other,17
friend the chancellor of the exchequer,17
is the minister aware that the,17
he will make a statement about,17
i hope that my hon friend,17
right hon member for finchley mrs,17
will my right hon and learned,17
secretary of state for scotland what,17
to which the hon gentleman referred,17
secretary of state for defence if,17
the minister of state foreign and,17
minister of state foreign and commonwealth,17
of state foreign and commonwealth office,17
learned member for monklands east mr,17
right hon friend the leader of,17
hon friend the leader of the,17
un secretarygeneral javier prez de cullar,17
i am sure that my hon,17
or cause or permit to be,17
cause or permit to be used,17
this point can be proved by,17
northern echo reporters work throughout cleveland,17
echo reporters work throughout cleveland and,17
reporters work throughout cleveland and north,17
work throughout cleveland and north yorkshire,17
throughout cleveland and north yorkshire to,17
cleveland and north yorkshire to bring,17
and north yorkshire to bring you,17
are twin bedded with a private,16
attainment targets and programmes of study,16
sat down on one of the,16
on the part of those who,16
which has nothing to do with,16
there is still a lot of,16
by the confederation of british industry,16
the ordination of women to the,16
ordination of women to the priesthood,16
do not seem to have been,16
there is no doubt at all,16
when all is said and done,16
in the hope that it would,16
it is not surprising then that,16
the end of world war ii,16
in the hands of a few,16
is in marked contrast to the,16
he was one of the most,16
have to face the fact that,16
there was a time when i,16
do not believe that it is,16
for the best part of a,16
had anything to do with the,16
in the tenth and eleventh centuries,16
in the course of their work,16
how did you know i was,16
in the late eighteenth and early,16
is not as easy as it,16
towards the end of the decade,16
was one of a number of,16
one of the best ways of,16
on the other side of a,16
there is no need to be,16
to be on the verge of,16
the first part of this chapter,16
to get to know each other,16
at the same time we are,16
went so far as to say,16
she did not want to be,16
and on the other hand the,16
by no means the only one,16
for a long time and i,16
this is not the end of,16
the beginning of the end for,16
there would have to be a,16
it is important to point out,16
has a role to play in,16
on the side of the head,16
from all over the world to,16
the edge of the penalty area,16
at the same time trying to,16
the national society for the prevention,16
national society for the prevention of,16
it does not follow that the,16
in most parts of the world,16
there is a strong case for,16
it is necessary to look at,16
made up of a number of,16
much the same way as a,16
