at the end of the day,712
on the other side of the,688
ask the secretary of state for,491
to ask the secretary of state,488
from the point of view of,443
at the other end of the,335
in such a way as to,305
in the middle of the night,264
one two three four five six,241
the department of trade and industry,232
what are you going to do,220
this is not to say that,207
the pound is up at one,205
by the end of the year,204
pound is up at one dollar,204
all you have to do is,194
the pound is down at one,191
pound is down at one dollar,191
at the far end of the,187
the secretary of state for the,183
if he will make a statement,183
secretary of state for the environment,181
still to come on central news,179
my right hon and learned friend,171
in the second half of the,166
that's all from us for now,166
at the end of the year,165
two three four five six seven,165
on the far side of the,163
at the turn of the century,161
and at the end of the,155
the point of view of the,154
at the end of the month,145
you're listening to the fox report,142
the secretary of state for scotland,139
that i gave some moments ago,139
there is no such thing as,137
at the same time as the,136
do you know what i mean,134
and all the rest of it,133
to the reply that i gave,133
three four five six seven eight,132
in much the same way as,131
the end of the nineteenth century,128
the reply that i gave some,127
reply that i gave some moments,126
does my right hon friend agree,126
da da da da da da,123
in the first half of the,122
it is a good idea to,122
by the end of the century,119
there can be no doubt that,117
price includes dinner bed and breakfast,116
my right hon friend agree that,116
right hon friend the secretary of,116
hon friend the secretary of state,116
there is no doubt that the,115
there can be little doubt that,114
what can i do for you,114
it is interesting to note that,114
for the rest of his life,113
what are we going to do,112
is to be found in the,111
in the best interests of the,111
he will make a statement on,110
to the other side of the,109
the early hours of the morning,108
my right hon friend the secretary,106
to come to terms with the,104
on the one hand and the,104
right hon friend the member for,104
on the edge of the bed,103
of state for trade and industry,103
secretary of state for trade and,100
it is important to remember that,99
in the same way as the,99
in spite of the fact that,99
as in the case of the,99
of state for education and science,99
on a point of order mr,99
my right hon friend the member,99
it is important to note that,98
in such a way that the,97
four five six seven eight nine,97
it would be a good idea,96
in the early years of the,96
the parliamentary undersecretary of state for,96
at the end of the season,95
it has been suggested that the,95
in order to be able to,94
it should be noted that the,94
at the end of the first,92
do you want me to do,92
it is difficult to see how,91
only a matter of time before,90
president of the board of trade,90
the court of appeal held that,89
an increase in the number of,88
in the early hours of the,88
a point of order mr speaker,88
there is a great deal of,87
the secretary of state for education,87
there have been a number of,86
the world wide fund for nature,86
the secretary of state for trade,86
had nothing to do with the,85
i don't know what to do,85
is one of the most important,85
secretary of state for education and,85
of state for foreign and commonwealth,85
state for foreign and commonwealth affairs,85
it is to be hoped that,84
as far as i can see,84
three four one two three four,84
in the middle of the road,83
the other side of the road,83
at the end of the war,83
the department of education and science,83
for the rest of the day,82
in the middle of the room,82
look forward to hearing from you,82
on the opposite side of the,81
to be one of the most,81
secretary of state for foreign and,81
if you know what i mean,80
i don't know what it is,80
the other end of the scale,79
on the floor of the house,79
to a greater or lesser extent,79
the secretary of state for foreign,79
at the back of the house,78
in view of the fact that,78
will make a statement on the,78
from the other side of the,77
if you see what i mean,77
in such a way that it,77
right hon friend the prime minister,77
am grateful to my hon friend,77
does my hon friend agree that,77
on both sides of the atlantic,76
at the top of the stairs,76
it seems to me that the,76
my right hon friend the prime,76
anne still to come on central,76
i am grateful to my hon,76
at one and the same time,75
on the other hand there are,75
the end of the eighteenth century,75
but at the end of the,75
secretary of state for northern ireland,74
what do you want me to,74
the end of the second world,73
end of the second world war,73
it was only a matter of,73
as far as i was concerned,73
friend the secretary of state for,73
i refer the hon gentleman to,73
over a long period of time,72
and by the end of the,72
ministry of agriculture fisheries and food,72
and so on and so forth,72
contact sema software technology technical support,72
sema software technology technical support department,72
software technology technical support department for,72
refer the hon gentleman to the,72
for the first time in the,71
in other parts of the world,71
it is for this reason that,71
a hell of a lot of,71
five six seven eight nine ten,71
for the rest of her life,70
it is fair to say that,70
it will be interesting to see,70
to meet the needs of the,70
before the end of the year,70
the secretary of state for health,70
at the end of the second,69
on the other hand it is,69
of the way in which the,69
that is not to say that,69
ha ha ha ha ha ha,69
gentleman to the reply that i,69
in many parts of the world,68
in exactly the same way as,68
i look forward to hearing from,68
the secretary of state for defence,68
hon gentleman to the reply that,68
i refer my hon friend to,68
refer my hon friend to the,68
the right hon and learned gentleman,68
it would be a mistake to,67
by the department of the environment,67
there was a great deal of,67
i would be grateful if you,67
in the early part of the,67
as a matter of fact i,67
at the end of the week,67
for the first time in his,66
society for the protection of birds,66
the right place at the right,66
there is a sense in which,66
but there was no sign of,66
by the end of the month,66
i want to talk to you,66
doo doo doo doo doo doo,66
no special lifespan privileges are required,66
receive a bottle of sparkling wine,66
the hon gentleman to the reply,66
royal society for the protection of,65
at the end of last year,65
the end of the cold war,65
right place at the right time,65
for the first time in her,65
don't know what you're talking about,65
the royal society for the protection,64
this does not mean that the,64
on the other hand if the,64
is not to say that the,64
i don't know what you mean,64
special lifespan privileges are required to,64
that is all from us for,64
is all from us for now,64
the following cases are referred to,64
following cases are referred to in,64
cases are referred to in the,64
to be on the safe side,63
it has to be said that,63
the house of lords held that,63
it is not surprising that the,63
from the first lateral arm plate,63
and if he will make a,63
in the right place at the,62
it remains to be seen whether,62
the reason for this is that,62
minister of agriculture fisheries and food,62
the prince and princess of wales,62
of state for the home department,62
the secretary of state for northern,62
the facts are stated in the,62
is my right hon friend aware,62
it is all too easy to,61
the middle of the nineteenth century,61
second half of the nineteenth century,61
the first time in her life,61
on the spur of the moment,61
at the beginning of the year,61
the ministry of agriculture fisheries and,61
lifespan privileges are required to use,61
privileges are required to use this,61
are required to use this option,61
right hon and learned friend the,61
on the wrong side of the,60
some of the ways in which,60
the second half of the nineteenth,60
has nothing to do with the,60
on the other hand there is,60
in other parts of the country,60
the secretary of state for wales,60
the secretary of state for transport,60
and all that sort of thing,60
the secretary of state for employment,60
includes dinner or lunch bed and,60
my noble and learned friend lord,60
the other side of the world,59
this is one of the most,59
it has nothing to do with,59
is no such thing as a,59
on both sides of the house,59
price includes dinner or lunch bed,59
dinner or lunch bed and breakfast,59
additional cases were cited in argument,59
had it not been for the,58
there was no sign of the,58
by the end of the decade,58
to do with the fact that,58
to have a look at the,58
was only a matter of time,58
in the centre of the room,58
it is one of the most,58
to the secretary of state for,58
at the same time it is,58
would be a good idea to,57
the european court of human rights,57
as an integral part of the,57
for the rest of your life,57
but there is no doubt that,57
by the secretary of state for,57
general agreement on tariffs and trade,57
my hon friend to the reply,57
hon friend to the reply that,57
friend to the reply that i,57
it was going to be a,56
out of the corner of his,56
as far as i am concerned,56
it was a bit of a,56
that at the end of the,56
in the early days of the,56
in the same way as a,56
at this time of the year,56
four one two three four one,56
by my right hon friend the,56
in recent years there has been,55
for the first time since the,55
at the beginning of the century,55
what am i going to do,55
button one for yes and button,55
one for yes and button two,55
for yes and button two for,55
yes and button two for no,55
it had nothing to do with,55
secretary of state for the home,55
i am grateful to the hon,55
i don't want to talk about,54
with the back of his hand,54
it was the first time that,54
i agree with my hon friend,54
the first time in his life,53
out of the corner of her,53
the other side of the coin,53
he was a member of the,53
a step in the right direction,53
please contact sema software technology technical,53
facts are stated in the judgment,53
the house met at halfpast twoo'clock,53
my right hon friend aware that,53
the other end of the line,52
it is hard to see how,52
the department of health and social,52
at the end of a long,52
is not just a matter of,52
by the end of the week,52
are you going to do about,52
there was a knock on the,52
but this does not mean that,52
which may or may not be,52
in such a way that they,52
to the profit and loss account,52
if it had not been for,51
what do you think of the,51
for the rest of my life,51
sat on the edge of the,51
all i can say is that,51
there was nothing she could do,51
would be grateful if you could,51
it is not always easy to,51
please do not hesitate to contact,51
what are you gon na do,51
the price includes dinner bed and,51
the following additional cases were cited,51
following additional cases were cited in,51
in different parts of the country,50
there is no reason to suppose,50
the latest in a series of,50
are to be found in the,50
all the time in the world,50
for the rest of their lives,50
there is no reason why the,50
on the banks of the river,49
to be a member of the,49
up in the middle of the,49
it's got nothing to do with,49
it may well be that the,49
there are a lot of people,49
the minister of agriculture fisheries and,49
the far end of the room,49
department of health and social security,48
at the foot of the stairs,48
on the first day of the,48
for the rest of the season,48
to be taken into account in,48
a long way to go before,48
the end of the day the,48
looked from one to the other,48
in the early stages of the,48
i don't know what you're talking,48
and it seems to me that,48
the general agreement on tariffs and,48
the up and down arrow keys,48
the oral shield from the first,48
grateful to my hon friend for,48
by my hon friend the member,48
council for the protection of rural,47
of the corner of her eye,47
around the turn of the century,47
as we shall see in the,47
that by the end of the,47
at the end of the tunnel,47
the fact of the matter is,47
that's all there is to it,47
the late nineteenth and early twentieth,47
it might be a good idea,47
in the back of the car,47
there is likely to be a,47
the secretary of state for energy,47
because at the end of the,47
what i want you to do,47
do you see what i mean,47
using the up and down arrow,47
oral shield from the first lateral,47
shield from the first lateral arm,47
as my hon friend the member,47
would not have been able to,46
and the rest of the world,46
to make the best use of,46
two or three times a week,46
as far as he was concerned,46
in the middle of the day,46
of the corner of his eye,46
with the rest of the world,46
conference on security and cooperation in,46
there is a need for a,46
at the beginning of this chapter,46
i should be grateful if you,46
it has been argued that the,46
six seven eight nine ten eleven,46
it was something to do with,45
was one of the first to,45
for the first time in my,45
there is little doubt that the,45
you will not be able to,45
there are a large number of,45
out of the window at the,45
what it would be like to,45
the beginning of the nineteenth century,45
is an integral part of the,45
there are a number of reasons,45
what do you want to do,45
the other side of the room,45
the first of its kind in,45
i didn't know what to do,45
i do not believe that the,45
for the protection of rural england,44
governor of the bank of england,44
at the end of the last,44
at the time of going to,44
the first time in my life,44
from the rest of the world,44
the first half of the nineteenth,44
in this part of the world,44
at the start of the second,44
i don't know what to say,44
light at the end of the,44
on security and cooperation in europe,44
what do you think of that,44
if it hadn't been for the,44
i don't know i don't know,44
was a knock on the door,44
is an input parameter specifying the,44
however by using the up and,44
by using the up and down,44
up and down arrow keys the,44
and down arrow keys the display,44
down arrow keys the display area,44
arrow keys the display area can,44
keys the display area can be,44
the display area can be scrolled,44
display area can be scrolled to,44
area can be scrolled to access,44
you should advise your lifespan manager,44
should advise your lifespan manager who,44
advise your lifespan manager who should,44
at the bottom of the stairs,43
to have anything to do with,43
the council for the protection of,43
is no reason to suppose that,43
the same is true of the,43
and in the case of the,43
to get the best out of,43
was the first time she had,43
on the face of it the,43
first half of the nineteenth century,43
be seen in the context of,43
at the end of the nineteenth,43
the end of the seventeenth century,43
if on the other hand the,43
it is at this point that,43
can be scrolled to access any,43
be scrolled to access any remaining,43
scrolled to access any remaining lines,43
if the problem still exists please,43
the problem still exists please contact,43
technology technical support department for assistance,43
are referred to in the judgment,43
the right hon and learned member,43
right hon and learned member for,43
i thank my hon friend for,43
c usual methods of proving these,43
usual methods of proving these points,43
to bring you the region's most,43
bring you the region's most comprehensive,43
you the region's most comprehensive news,43
the region's most comprehensive news service,43
got out of the car and,42
of the ways in which the,42
the time of going to press,42
the early years of this century,42
by the turn of the century,42
in the heat of the moment,42
there are a number of ways,42
as long as i can remember,42
what i was going to say,42
late nineteenth and early twentieth centuries,42
at the side of the road,42
because of the nature of the,42
in the first part of the,42
the president of the board of,42
your lifespan manager who should restart,42
lifespan manager who should restart lifespan,42
honeymoon and silver anniversary couples receive,42
that my right hon friend the,42
at the top of the hill,41
at the top end of the,41
it can be seen that the,41
by the end of the day,41
still a long way to go,41
have something to do with the,41
it should also be noted that,41
that there is no such thing,41
the end of the day it,41
what do you think you're doing,41
for the first time in a,41
it should be borne in mind,41
not going to be able to,41
the more likely it is that,41
the rule in rylands v fletcher,41
do not hesitate to contact me,41
problem still exists please contact sema,41
still exists please contact sema software,41
and silver anniversary couples receive a,41
silver anniversary couples receive a bottle,41
anniversary couples receive a bottle of,41
couples receive a bottle of sparkling,41
a bottle of sparkling wine and,41
is down at one dollar fifty,41
my hon friend is absolutely right,41
it is hard to believe that,40
know as well as i do,40
played an important part in the,40
on the table in front of,40
it is often the case that,40
have a long way to go,40
it can be argued that the,40
and there is no doubt that,40
stood in the middle of the,40
in order to ensure that the,40
by the end of the nineteenth,40
i think it would be a,40
the exception rather than the rule,40
the beginning of the end of,40
have nothing to do with the,40
and at the same time to,40
the best thing to do is,40
the second half of the year,40
the purpose of this chapter is,40
to a greater or lesser degree,40
i don't know what it was,40
the end of the day you,40
what do you mean by that,40
ownership of the means of production,40
all you need to do is,40
a reduction in the number of,40
and will continue to do so,40
it is important to realise that,40
it could be argued that the,40
it turned out to be a,40
exists please contact sema software technology,40
and up at two marks forty,40
my right hon friend the chancellor,40
but at the same time it,39
is one of the reasons why,39
through no fault of their own,39
in many parts of the country,39
due to the fact that the,39
all she had to do was,39
it is difficult to believe that,39
at the other side of the,39
you don't have to worry about,39
whether we like it or not,39
at the start of the season,39
on the north side of the,39
was the first time he had,39
at the end of the road,39
beyond the scope of this book,39
the rest of the united kingdom,39
the best will in the world,39
it is reasonable to assume that,39
a quarter of a million pounds,39
give a true and fair view,39
secretary of state for social security,39
you know as well as i,38
it was one of the most,38
the european convention on human rights,38
at the top of his voice,38
what it was like to be,38
and the way in which the,38
at the opposite end of the,38
to terms with the fact that,38
it was nothing to do with,38
most natural thing in the world,38
court of appeal held that the,38
what do you want to know,38
that there are a number of,38
the law into their own hands,38
i have to say that i,38
to find out more about the,38
to be in a position to,38
on the right side of the,38
for the first time in their,38
one of the main reasons for,38
at the lower end of the,38
at the time of writing the,38
so it is not surprising that,38
we need to be able to,38
that it is not possible to,38
at the head of the table,38
until the end of the season,38
appeal to the house of lords,38
with the best will in the,38
in the corner of the room,38
purpose of this chapter is to,38
as can be seen from the,38
in the latter part of the,38
or to put it another way,38
in the execution of his duty,38
from one generation to the next,38
should be grateful if you would,38
for the rest of the week,38
what i'd like you to do,38
is my hon friend aware that,38
my right hon friend confirm that,38
hon and learned friend the member,38
and learned friend the member for,38
of my hon friend the member,38
and repeat to the other side,38
at the end of the century,37
the most natural thing in the,37
can be no doubt that the,37
in some parts of the country,37
i thought he was going to,37
for as long as i can,37
one of the reasons for the,37
we shall see in the next,37
only the tip of the iceberg,37
to the way in which the,37
an important role to play in,37
there is no reason to believe,37
i have had the advantage of,37
of the secretary of state for,37
for the rest of the year,37
there was nothing i could do,37
to come on central news the,37
am grateful to the hon gentleman,37
at the bottom of the garden,36
is not the end of the,36
had something to do with the,36
by the end of the first,36
on the south side of the,36
is an essential part of the,36
the president of the united states,36
the second half of the century,36
have anything to do with the,36
at least for the time being,36
it was the first time she,36
at the end of this chapter,36
the health and safety at work,36
the middle of the night and,36
in terms of the number of,36
a force to be reckoned with,36
in the same way that the,36
is at the heart of the,36
at the top of the list,36
all we have to do is,36
to the other end of the,36
it is true to say that,36
don't want to talk about it,36
the end of the financial year,36
the first of a series of,36
it should be noted however that,36
it is the responsibility of the,36
there is no evidence that the,36
i thought you were going to,36
in the sense that it is,36
at the foot of the page,36
to get to the bottom of,36
the office of population censuses and,36
do you want a cup of,36
the secretary of state for social,36
keyword in the rdbi configuration file,36
error has occurred while processing your,36
is up at one dollar fifty,36
have had the advantage of reading,36
my right hon friend accept that,36
of my right hon friend the,36
my hon friend is right to,36
to my hon friend the member,36
the hon and learned member for,36
i thank my right hon friend,36
at the end of the book,35
at the touch of a button,35
it is easy to see why,35
all the way back to the,35
from the other end of the,35
in the first round of the,35
what's that got to do with,35
this is not to suggest that,35
at the back of his mind,35
is in the best interests of,35
only a small part of the,35
to the rest of the world,35
but by the end of the,35
and yet at the same time,35
one of the ways in which,35
during the first half of the,35
what the hell are you doing,35
that there is a need for,35
it was a long time ago,35
i don't want to go to,35
is the way in which the,35
should be borne in mind that,35
there is such a thing as,35
in accordance with the terms of,35
there is a wide range of,35
to have a look at it,35
thank you very much indeed for,35
seven eight nine ten eleven twelve,35
office of population censuses and surveys,35
six four one six four one,35
if this field is left blank,35
bottle of sparkling wine and flowers,35
grateful to the hon gentleman for,35
ask the minister of agriculture fisheries,35
right hon friend agree that the,35
members on both sides of the,35
are just a few of the,34
to cut a long story short,34
what on earth are you doing,34
we are going to have to,34
he went on to say that,34
sitting on the edge of the,34
at the same time there was,34
it is not always possible to,34
there has been a lot of,34
the end of the last century,34
on the other end of the,34
the edge of the bed and,34
for two and a half years,34
if there is to be a,34
the governor of the bank of,34
at the end of this month,34
that you will be able to,34
towards the end of the year,34
have had something to do with,34
and for the first time in,34
it would be interesting to know,34
and then all of a sudden,34
i thought i was going to,34
is an important part of the,34
at the back of her mind,34
is in the hands of the,34
at the top of the page,34
on the grounds that it is,34
to decide whether or not to,34
is beyond the scope of this,34
in so far as it is,34
is there anything i can do,34
has been one of the most,34
on the grounds that it would,34
one or more of the following,34
on the grounds that it was,34
from one side to the other,34
could be further from the truth,34
at the end of the corridor,34
had nothing to do with it,34
you want a cup of tea,34
a lot of work to do,34
the al of maintaining a safe,34
al of maintaining a safe environment,34
no recent change in status is,34
will my right hon friend confirm,34
to ask the minister of agriculture,34
the question of whether or not,33
right in the middle of the,33
out of all proportion to the,33
at some time in the future,33
in the rest of the world,33
at the beginning of this century,33
you going to do about it,33
in the way in which the,33
so far as to say that,33
there is no evidence to suggest,33
to the department of the environment,33
an area of outstanding natural beauty,33
the conference on security and cooperation,33
i don't see why i should,33
have to be taken into account,33
had a lot to do with,33
nothing at all to do with,33
it is not surprising therefore that,33
the extent to which it is,33
