to be able to go to,13
that in the case of the,13
it would be better if i,13
there was something wrong with the,13
a number of factors such as,13
i don't think i've ever seen,13
but in the end it was,13
for the second time that day,13
i hope you don't mind me,13
this is going to be the,13
must rank as one of the,13
will have to wait and see,13
it will be a matter of,13
for the first time on the,13
may well be the case that,13
down to the bottom of the,13
it to the attention of the,13
so far as i can see,13
at the annual meeting of the,13
it is still too early to,13
of the fact that he was,13
his hands in his pockets and,13
half in and half out of,13
to meet the demands of the,13
there were tears in his eyes,13
over the next couple of weeks,13
on the other hand is not,13
is more likely to be a,13
there is no evidence that he,13
less than a third of the,13
it would have been easy to,13
all there is to know about,13
he would have been able to,13
be interpreted in the light of,13
change in the nature of the,13
so far we have looked at,13
can be one of the most,13
in the later part of the,13
are much more likely to be,13
the more i think about it,13
to spend the rest of my,13
a lot of time and effort,13
may not be the same as,13
get in the way of the,13
is greater than the sum of,13
on the side of the angels,13
is part and parcel of the,13
one of the reasons why i,13
i would have loved to have,13
a long time since she had,13
that as many people as possible,13
to go all the way to,13
the first time she had been,13
are at the bottom of the,13
i was going to have a,13
entered into the spirit of the,13
does not mean that there is,13
this is an example of the,13
there may be more than one,13
it is important to appreciate that,13
reference has already been made to,13
no more than a couple of,13
she turned on her heel and,13
at her for a long moment,13
it as if it were a,13
there was no sign of life,13
in the context of the present,13
the world bank and the international,13
between on the one hand the,13
it was the turn of the,13
the name of the game is,13
if there is to be any,13
the imf and the world bank,13
it does not take into account,13
at the royal bank of scotland,13
at this stage of the season,13
on the back of the neck,13
leave to appeal to the house,13
went on and on and on,13
but there is no need to,13
the other side of the channel,13
there were so many of them,13
but it is not easy to,13
easiest thing in the world to,13
from the edge of the box,13
she could see that he was,13
for three and a half years,13
on the edge of the penalty,13
the depletion of the ozone layer,13
and there can be no doubt,13
or not as the case may,13
not as the case may be,13
there is no evidence that they,13
it is a sign of the,13
until the end of the week,13
it is no accident that the,13
would not have been possible without,13
there were also a number of,13
this is in line with the,13
which have nothing to do with,13
it would be reasonable to expect,13
it was the middle of the,13
is right and what is wrong,13
on to the end of the,13
on the other hand it could,13
by the economic and social research,13
but not at the expense of,13
all or any part of the,13
it must not be forgotten that,13
at pains to point out that,13
a part to play in the,13
it is a pity that the,13
in a very short space of,13
to the office of fair trading,13
the royal commission on environmental pollution,13
for the protection of birds rspb,13
the only thing you can do,13
kill two birds with one stone,13
it is necessary to examine the,13
will be given the opportunity to,13
by the european court of justice,13
the government of the republic of,13
in the public and private sectors,13
in both the public and private,13
it in the middle of the,13
took me a long time to,13
to know what is going on,13
it should be noted that in,13
the variety of ways in which,13
as well as being able to,13
gone out of his way to,13
do not form part of the,13
can be traced back to the,13
in the absence of any other,13
the first time in the history,13
has always been one of the,13
on the other hand we can,13
at the same time they are,13
into the centre of the room,13
the end of the day there,13
will be interesting to see if,13
increase in the number of people,13
that have taken place in the,13
in the first decade of the,13
the local authority social services department,13
to the secretary of state who,13
i want to show you something,13
are you sure you don't want,13
not for the first time she,13
to be seen as part of,13
would be wrong to assume that,13
in too much of a hurry,13
the early years of the nineteenth,13
there are still a number of,13
on the outskirts of the town,13
the last few years have seen,13
is not open to the public,13
are a number of ways of,13
but it is not the only,13
have to take account of the,13
was the beginning of the end,13
length and breadth of the country,13
it does not seem to be,13
what we have here is a,13
the best way to do that,13
i look forward to seeing you,13
one of the founders of the,13
went on for a long time,13
on the same level as the,13
played a key role in the,13
at the massachusetts institute of technology,13
the department of health and the,13
edge of the cake drum securing,13
move the vote now be put,13
motion will stand referred to the,13
committee for consideration and report unless,13
for consideration and report unless the,13
consideration and report unless the council,13
upon councillor to move the motion,13
and the world wide fund for,13
the council of the law society,13
and as a result of that,13
the right of appeal to the,13
in the hotel and catering industry,13
on the balance of probabilities that,13
that we are dealing with a,13
difficult to avoid the conclusion that,13
let's just have a look at,13
would have liked to have seen,13
so it seems to me that,13
explained by the fact that the,13
the reduction in the number of,13
be due to the fact that,13
is often the case that the,13
it seems to me that that,13
a great deal to do with,13
this does not mean that we,13
should be in a position to,13
from a personal point of view,13
rate of growth of the money,13
if that is the case then,13
to say a few words about,13
there has been a tendency to,13
department of the environment and the,13
exactly the same way as the,13
i haven't had a chance to,13
be able to take advantage of,13
needs to be taken into account,13
that's what i was gon na,13
and on the other side of,13
one of the features of the,13
as a matter of fact the,13
there was no difference in the,13
as one of the most important,13
day to day running of the,13
increase in the size of the,13
no reason to believe that the,13
in the normal course of business,13
it could be argued that this,13
it could be said that the,13
as to the identity of the,13
needs to be given to the,13
of what is going on in,13
and the same is true of,13
have little to do with the,13
it is not necessarily the case,13
is not necessarily the case that,13
was the latest in a series,13
from the middle of the nineteenth,13
it is now clear that the,13
which is at the heart of,13
until the end of the war,13
such a way that it can,13
over the past two or three,13
how do you feel about it,13
but it is not clear that,13
it is not clear that the,13
there are various ways in which,13
is sometimes referred to as the,13
during the passage of the bill,13
like to have a look at,13
i don't think that would be,13
at the end of the game,13
towards the end of the season,13
it was the first time the,13
is also a member of the,13
which is an integral part of,13
took place against a background of,13
to the extent to which the,13
and that there should be a,13
is the most important part of,13
should not be seen as a,13
as a director of the company,13
it is important to try to,13
if it is not possible to,13
made in the course of the,13
which is a bit of a,13
that's what i was going to,13
it's not the sort of thing,13
had been a long time since,13
would have nothing to do with,13
can't for the life of me,13
i know what you're going to,13
be in the right place at,13
there was a tap at the,13
in one or other of the,13
looked as though it had been,13
he spent a lot of time,13
have to take into account the,13
very different from that of the,13
if you really want to know,13
but when it comes down to,13
there is only one way to,13
will be able to give you,13
there is no way of telling,13
i am not aware of any,13
i do not know of any,13
for the first time it was,13
towards the end of the eighteenth,13
as if it had never been,13
constable in the execution of his,13
the fact that it is not,13
at the end of the previous,13
the other members of the group,13
lead to a reduction in the,13
and it is not easy to,13
that in the absence of a,13
at the same time there were,13
towards the end of the week,13
half of the nineteenth century and,13
she could not bring herself to,13
to a much greater extent than,13
but it turned out to be,13
at the end of the night,13
you don't need to worry about,13
what have i got to do,13
is at this point that the,13
stage in the development of the,13
it has the advantage of being,13
yet at the same time the,13
but there is no evidence of,13
it would have been impossible to,13
this is a matter for the,13
it was as if she was,13
led to the setting up of,13
sitting at the back of the,13
depends on the size of the,13
the arts council of great britain,13
that it would be a good,13
i was lucky enough to be,13
the last ten years or so,13
synod of the church of england,13
that the time had come for,13
on the crest of a wave,13
that it will be possible to,13
is a good example of this,13
of the most important of these,13
to be used in conjunction with,13
well i don't know about that,13
i don't know what i've done,13
you ought to be able to,13
know what i was going to,13
to be explained in terms of,13
i want to go back to,13
at one end of the room,13
to understand the nature of the,13
woke up in the middle of,13
he looked as if he had,13
a vote of confidence in the,13
depend to a large extent on,13
are to be included in the,13
in the daytoday running of the,13
it is the job of the,13
for as long as possible and,13
it is beyond the scope of,13
act in the interests of the,13
in a way which does not,13
was at the heart of the,13
no limit to the number of,13
the question as to whether the,13
in the sense that it was,13
if it can be shown that,13
at a time when he was,13
no reason why it should not,13
at the beginning of the next,13
but in the light of the,13
is a vital part of the,13
you want me to go and,13
the only way you can do,13
for a long period of time,13
before the turn of the century,13
majority of people in this country,13
to make sure that it is,13
a waste of time and money,13
get to the bottom of the,13
there is a lot of work,13
do you want to come in,13
i do not think that we,13
came to the conclusion that it,13
a lot of a lot of,13
you can have a look at,13
this will be the first time,13
i thought it was a bit,13
i think it would have been,13
that there is no question of,13
i was gon na say i,13
which may or may not have,13
you to have a look at,13
the events leading up to the,13
i do not think that that,13
get to the end of the,13
m heathwood mrs s higham mrs,13
up to the point at which,13
where the hell have you been,13
but there was nothing she could,13
the c e c is asking,13
it looked as if it had,13
to stare out of the window,13
and there was nothing she could,13
there is much to be gained,13
i think it would be best,13
there was no way she was,13
it is likely that you will,13
in the guinness book of records,13
european court of human rights in,13
she sat on the edge of,13
it should be noted that there,13
she said in a small voice,13
and sat on the edge of,13
from the corner of her eye,13
it was difficult to believe that,13
what was the name of the,13
which can be used as a,13
i don't want to see him,13
was one of the few who,13
was at the bottom of the,13
to get in touch with me,13
in front of the house and,13
i have anything to do with,13
do you expect me to do,13
the time in the world to,13
to take it for granted that,13
they made their way to the,13
the door was flung open and,13
you should be able to see,13
the black sheep of the family,13
will be able to see the,13
of the confederation of british industry,13
who is a member of the,13
off at the end of the,13
to come to terms with their,13
it may or may not be,13
have to put up with the,13
he turned and looked at her,13
was nothing to do with me,13
the public to the private sector,13
she heard the sound of a,13
how would you like to be,13
by the time he had finished,13
but this was the first time,13
in the economy as a whole,13
put a hand on his shoulder,13
at the edge of the wood,13
and it turned out to be,13
that he did not have to,13
an hour and a half and,13
the distribution of income and wealth,13
back the way he had come,13
oh dear oh dear oh dear,13
i knew i was going to,13
had never seen anything like it,13
do you think i ought to,13
know the meaning of the word,13
looking out of the window at,13
what do you expect me to,13
put his hands on her shoulders,13
i'm trying to say is that,13
she turned her back on him,13
was always going to be a,13
will be out of action for,13
more than a hundred and fifty,13
asked to draw your attention to,13
of cost and net realisable value,13
further information can be obtained from,13
very conscious of the fact that,13
by the secretary of state in,13
i would be most grateful if,13
and make a cup of tea,13
at the best of times but,13
for years and years and years,13
and there used to be a,13
what do you have to do,13
the back of the car and,13
that he was going to be,13
we used to we used to,13
used to be a lot of,13
in connection with the murder of,13
the late fifties and early sixties,13
to be able to talk to,13
when she got back to the,13
two and a half years and,13
do you think you're going to,13
of this approach is that it,13
there are a number of possible,13
what are you trying to say,13
have a profound effect on the,13
which is just as well because,13
by no stretch of the imagination,13
the aim of this chapter is,13
it has been one of the,13
that the time has come to,13
the middle of the room and,13
i don't want to hear any,13
the way he looked at her,13
stared at him for a moment,13
er er er er er er,13
ba ba ba ba ba ba,13
twelve thirteen fourteen fifteen sixteen seventeen,13
the end of the year but,13
as far as i know the,13
the second half of the eighteenth,13
second half of the eighteenth century,13
of the department of education and,13
more work needs to be done,13
was the first time they had,13
one of the wonders of the,13
i do not think that there,13
with each other and with the,13
in the hope that it will,13
what do you know about the,13
of the way in which they,13
to understand what is going on,13
first decade of the twentieth century,13
has to be seen in the,13
at the beck and call of,13
that one of the reasons why,13
on the west bank of the,13
your knees close to your chest,13
knees close to your chest and,13
and address on a postcard to,13
that the time had come to,13
all quiet on the western front,13
since the beginning of the century,13
and i do not believe that,13
the north york moors national park,13
by the office of population censuses,13
is one of the most common,13
the early hours of this morning,13
spent most of his time in,13
what have you got to do,13
for a couple of years and,13
the commission of the european communities,13
that a large part of the,13
from the department of social security,13
shoulders knees and toes knees and,13
knees and toes knees and toes,13
bear went over the mountain the,13
i said well i don't know,13
was the other side of the,13
do you want a bit of,13
think it's going to be a,13
don't know what to do about,13
i know a lot of people,13
what can you do about it,13
let me have a look at,13
i don't think i can do,13
fourteen sixteen eighteen twenty twenty two,13
four twenty six twenty eight thirty,13
seems to me to be the,13
i think it will be a,13
at grade c or above is,13
mathematics at grade c or above,13
award of the diploma in industrial,13
of the diploma in industrial studies,13
a gce o level or gcse,13
gce o level or gcse pass,13
the course is of four years',13
to the award of the diploma,13
more than a third of the,13
would you like to tell me,13
minister of state at the home,13
there is a real danger that,13
in the strict sense of the,13
in the last few years the,13
the far end of the table,13
just as she was about to,13
made a significant contribution to the,13
to the life of the community,13
to take her in his arms,13
what was going to happen next,13
of the department of social security,13
the power of the holy spirit,13
the other side of the bed,13
for a quarter of an hour,13
at an early stage of the,13
or as in the case of,13
at him for a moment then,13
the end of the day when,13
i would like to see a,13
it is of course possible to,13
the introduction of the community charge,13
if we are to have a,13
that's one of the reasons why,13
eighty four hundred and twenty four,13
fifty three eighty four hundred and,13
in the manual creating and controlling,13
return_detail is a return parameter providing,13
the modules contained in the package,13
states can be found in appendix,13
required to use this option as,13
to use this option as it,13
use this option as it is,13
to provide information for all lifespan,13
provide information for all lifespan users,13
if it is not changed the,13
it is not changed the set,13
is not changed the set of,13
following the current set will be,13
the current set will be displayed,13
information which was supplied for the,13
will be displayed here and can,13
be displayed here and can be,13
displayed here and can be updated,13
here and can be updated for,13
otherwise any existing details for your,13
you must have lifespan marketing privilege,13
action an unexpected error has occurred,13
an unexpected error has occurred eg,13
unexpected error has occurred eg lifespan,13
error has occurred eg lifespan has,13
and see what can be done,13
i hope you will be able,13
the interests of the ruling class,13
on the surface of the earth,13
the end of the day she,13
department of economic and social history,13
who has not been named was,13
at the back of this leaflet,13
general secretary rev carlos a valle,13
to prevent a breach of the,13
at least three times a week,13
the square root of minus one,13
the prime minister and the chancellor,13
he typed as harsnet had written,13
white white white white white white,13
respect of a fine workman i,13
of a fine workman i am,13
a fine workman i am but,13
to get myself into more work,13
indeed sir we make holiday to,13
sir we make holiday to see,13
some of today's main stories in,13
minister for local government and inner,13
for local government and inner cities,13
hundred shares index closed down ten,13
is up at one dollar eighty,13
wes still to come on central,13
by carl butler daily post staff,13
by sue cocker daily post staff,13
by andrew forgrave daily post staff,13
friend the secretary of state and,13
the secretary of state aware that,13
minister of state for the armed,13
to make use of the track,13
and fill in the missing words,13
do you plead guilty or not,13
that you are not a brain,13
the following judgments were handed down,13
their lordships took time for consideration,13
noble and learned friend lord brownewilkinson,13
i too would allow the appeal,13
search for a goal or for,13
for a goal or for a,13
a goal or for a path,13
the leader of the opposition to,13
to my hon friend for that,13
that my right hon friend will,13
if he has any plans to,13
state for the home department mr,13
state for the home department if,13
for the home department if he,13
the point made by the hon,13
hon member for finchley mrs thatcher,13
of state for northern ireland mr,13
to the hon gentleman for his,13
the attention of my right hon,13
my hon friend the minister for,13
that the right hon member for,13
for islington south and finsbury mr,13
islington south and finsbury mr smith,13
the purpose of this project is,13
college of south wales swansea additional,13
of south wales swansea additional sponsors,13
agreement to the terms of engagement,13
to the terms of engagement contained,13
the terms of engagement contained in,13
terms of engagement contained in this,13
of engagement contained in this letter,13
engagement contained in this letter will,13
contained in this letter will be,13
in this letter will be confirmation,13
elected for a fiveyear term by,13
president of the council and leader,13
council and leader of the house,13
for my right hon friend the,13
hon gentleman will be aware that,13
is the right hon gentleman aware,13
agree with the hon member for,13
mr deputy speaker mr harold walker,13
the hon member for dundee east,13
the lying position and repeat with,13
lying position and repeat with the,13
in graceful slow motion with each,13
graceful slow motion with each exercise,13
slow motion with each exercise leading,13
lying on your tummy raise your,13
on your tummy raise your head,13
your tummy raise your head and,13
tummy raise your head and shoulders,13
gently come back to the room,13
the photograph on the facing page,13
rooms are twin bedded with a,12
he is survived by his wife,12
we will do our best to,12
he turned out to be a,12
it was about this time that,12
not be able to cope with,12
and as a result of the,12
it was time for a change,12
at the bottom of the slope,12
i did not know what to,12
i do not wish to be,12
it is not true to say,12
it was during this period that,12
you should be able to do,12
for as long as he could,12
of the population as a whole,12
much has been made of the,12
could not have come at a,12
both on and off the field,12
of the commonwealth of independent states,12
there are a great number of,12
this is in marked contrast to,12
on the other hand he was,12
which had nothing to do with,12
by the time we got to,12
to find out what was happening,12
when it comes to the crunch,12
drew attention to the fact that,12
had turned out to be a,12
wanted to get out of the,12
he didn't know what to do,12
sat down at the kitchen table,12
thought it would be nice to,12
when he got back to the,12
it was all very well for,12
to find out what had happened,12
and it seemed to me that,12
it would be hard to find,12
in the same league as the,12
at the start of this chapter,12
he shook his head as if,12
think of anything else to say,12
get the hell out of here,12
at the same time it has,12
it would have been better for,12
of the first world war the,12
i am going to have to,12
is no such thing as the,12
have to learn to live with,12
and closed the door behind him,12
i would have thought it was,12
secretary of the national union of,12
recorded a verdict of death by,12
as good a place as any,12
of the bank of england and,12
climbed to the top of the,12
it is often said that the,12
that it is not so much,12
one of the most difficult things,12
but i don't know how to,12
has to be seen to be,12
if it is not to be,12
it wasn't like that at all,12
but it does not seem to,12
it does not seem to have,12
that may or may not be,12
for the rest of the morning,12
made it clear that he was,12
wanted to get away from the,12
end of the eighteenth century the,12
she felt as if she had,12
of the best in the country,12
as is the case with the,12
of the european exchange rate mechanism,12
had to be careful not to,12
plays an important role in the,12
at the time of the incident,12
into the roof of the net,12
could turn out to be a,12
the amount of time spent on,12
the fact that a number of,12
he is one of the few,12
by the department of health and,12
the us food and drug administration,12
the rest of the day is,12
in the federal republic of germany,12
and at the time of the,12
would be more accurate to say,12
be more accurate to say that,12
this is just one of the,12
much the same can be said,12
is an important factor in the,12
of the european convention on human,12
had more to do with the,12
one on each side of the,12
there is no point in having,12
three and a half thousand pounds,12
that it would be better for,12
it is possible to have a,12
all that is needed is a,12
are not in the business of,12
was the only one who could,12
and i don't want you to,12
the way he was looking at,12
it is also clear that the,12
the rest of the world and,12
old enough to be her father,12
upon a time there was a,12
when he spoke his voice was,12
it was the first time she'd,12
was nothing she could do to,12
by the time we reached the,12
during the eighteenth and nineteenth centuries,12
me at the end of the,12
when did you last see your,12
but it was not long before,12
it must also be remembered that,12
you want to have a look,12
can not be relied upon to,12
we will have to wait and,12
than it had been in the,12
in the first place it is,12
there is little to suggest that,12
can not be taken for granted,12
to make it look as if,12
has very little to do with,12
based on the assumption that the,12
over the past decade or so,12
nothing to do with the fact,12
